{
  "schema": "animation-ir",
  "version": 2,
  "id": "animation_main",
  "scene": {
    "width": 960,
    "height": 720,
    "objects": [
      {
        "id": "title",
        "type": "text",
        "x": 32.0,
        "y": 32.0,
        "width": 896.0,
        "height": 40.0,
        "text": "Two Sum",
        "values": [],
        "state": "normal",
        "edges": [],
        "directed": false
      },
      {
        "id": "values_view",
        "type": "array",
        "x": 32.0,
        "y": 112.0,
        "width": 896.0,
        "height": 336.0,
        "text": "",
        "values": [
          2,
          7,
          11,
          15
        ],
        "state": "normal",
        "edges": [],
        "directed": false
      },
      {
        "id": "explanation",
        "type": "text",
        "x": 32.0,
        "y": 472.0,
        "width": 896.0,
        "height": 72.0,
        "text": "",
        "values": [],
        "state": "normal",
        "edges": [],
        "directed": false
      },
      {
        "id": "state_view",
        "type": "text",
        "x": 32.0,
        "y": 568.0,
        "width": 896.0,
        "height": 120.0,
        "text": "",
        "values": [],
        "state": "normal",
        "edges": [],
        "directed": false
      }
    ]
  },
  "timeline": [
    {
      "at": 0.0,
      "duration": 0.12,
      "action": "update-value",
      "target": "values_view",
      "indices": [],
      "text": "",
      "values": [
        2,
        7,
        11,
        15
      ]
    },
    {
      "at": 0.0,
      "duration": 0.12,
      "action": "highlight",
      "target": "values_view",
      "indices": [],
      "text": "",
      "values": []
    },
    {
      "at": 0.0,
      "duration": 0.12,
      "action": "update-text",
      "target": "explanation",
      "indices": [],
      "text": "Two Sum · target 9",
      "values": []
    },
    {
      "at": 0.0,
      "duration": 0.12,
      "action": "update-text",
      "target": "state_view",
      "indices": [],
      "text": "",
      "values": []
    },
    {
      "at": 0.8,
      "duration": 0.12,
      "action": "update-value",
      "target": "values_view",
      "indices": [],
      "text": "",
      "values": [
        2,
        7,
        11,
        15
      ]
    },
    {
      "at": 0.8,
      "duration": 0.12,
      "action": "highlight",
      "target": "values_view",
      "indices": [
        0
      ],
      "text": "",
      "values": []
    },
    {
      "at": 0.8,
      "duration": 0.12,
      "action": "update-text",
      "target": "explanation",
      "indices": [],
      "text": "Index 0: 2; look for 7 in seen.",
      "values": []
    },
    {
      "at": 0.8,
      "duration": 0.12,
      "action": "update-text",
      "target": "state_view",
      "indices": [],
      "text": "seen: {}",
      "values": []
    },
    {
      "at": 1.6,
      "duration": 0.12,
      "action": "update-value",
      "target": "values_view",
      "indices": [],
      "text": "",
      "values": [
        2,
        7,
        11,
        15
      ]
    },
    {
      "at": 1.6,
      "duration": 0.12,
      "action": "highlight",
      "target": "values_view",
      "indices": [
        0
      ],
      "text": "",
      "values": []
    },
    {
      "at": 1.6,
      "duration": 0.12,
      "action": "update-text",
      "target": "explanation",
      "indices": [],
      "text": "Remember 2 → 0.",
      "values": []
    },
    {
      "at": 1.6,
      "duration": 0.12,
      "action": "update-text",
      "target": "state_view",
      "indices": [],
      "text": "seen: {\"2\":0}",
      "values": []
    },
    {
      "at": 2.4000000000000004,
      "duration": 0.12,
      "action": "update-value",
      "target": "values_view",
      "indices": [],
      "text": "",
      "values": [
        2,
        7,
        11,
        15
      ]
    },
    {
      "at": 2.4000000000000004,
      "duration": 0.12,
      "action": "highlight",
      "target": "values_view",
      "indices": [
        1
      ],
      "text": "",
      "values": []
    },
    {
      "at": 2.4000000000000004,
      "duration": 0.12,
      "action": "update-text",
      "target": "explanation",
      "indices": [],
      "text": "Index 1: 7; look for 2 in seen.",
      "values": []
    },
    {
      "at": 2.4000000000000004,
      "duration": 0.12,
      "action": "update-text",
      "target": "state_view",
      "indices": [],
      "text": "seen: {\"2\":0}",
      "values": []
    },
    {
      "at": 3.2,
      "duration": 0.12,
      "action": "update-value",
      "target": "values_view",
      "indices": [],
      "text": "",
      "values": [
        2,
        7,
        11,
        15
      ]
    },
    {
      "at": 3.2,
      "duration": 0.12,
      "action": "highlight",
      "target": "values_view",
      "indices": [
        0,
        1
      ],
      "text": "",
      "values": []
    },
    {
      "at": 3.2,
      "duration": 0.12,
      "action": "update-text",
      "target": "explanation",
      "indices": [],
      "text": "Found: indices 0 and 1 sum to 9.",
      "values": []
    },
    {
      "at": 3.2,
      "duration": 0.12,
      "action": "update-text",
      "target": "state_view",
      "indices": [],
      "text": "seen: {\"2\":0}",
      "values": []
    },
    {
      "at": 4.0,
      "duration": 0.12,
      "action": "update-value",
      "target": "values_view",
      "indices": [],
      "text": "",
      "values": [
        2,
        7,
        11,
        15
      ]
    },
    {
      "at": 4.0,
      "duration": 0.12,
      "action": "highlight",
      "target": "values_view",
      "indices": [],
      "text": "",
      "values": []
    },
    {
      "at": 4.0,
      "duration": 0.12,
      "action": "update-text",
      "target": "explanation",
      "indices": [],
      "text": "Result: [0,1]",
      "values": []
    },
    {
      "at": 4.0,
      "duration": 0.12,
      "action": "update-text",
      "target": "state_view",
      "indices": [],
      "text": "result: [0,1]\nseen: {\"2\":0}",
      "values": []
    }
  ],
  "duration": 4.800000000000001,
  "step_times": [
    0.0,
    0.8,
    1.6,
    2.4000000000000004,
    3.2,
    4.0
  ]
}